{
  "schema_version": "audio-qc-output.v1",
  "audio_artifact_id": "audio_scene_01",
  "measured_loudness_lufs": -23.8,
  "measured_peak_db": -0.8,
  "loudness_pass": true,
  "peak_pass": true,
  "fidelity_pass": true,
  "narration_text_hash": "a1b2c3d4e5f6a7b8c9d0e1f2a3b4c5d6e7f8a9b0c1d2e3f4a5b6c7d8e9f0a1b2",
  "omitted_phrases": [],
  "changed_phrases": [],
  "metadata": {
    "qc_tool": "ffmpeg_loudnorm",
    "check_duration_seconds": 0.5
  }
}